,place,review,date
122,Красное&Белое,"Хороший магазин, неплохой ассортимент товаров, всегда внимательный персонал. Но очень маленькое помещение. Чуть больше народа- в магазине не повернуться.",5 марта
123,Красное&Белое,"Маленький магазинчик, персонал приветливый",13 ноября 2022
124,Ермолино,Вкусно как дома! Поварам спасибо!,19 сентября
125,Ермолино,"Очень вкусная продукция, частенько здесь берем пельмени. Так же можно всегда приехать вкусно пообедать",24 августа
126,Ермолино,хороший магаз качество соответствуют ценам,18 июня
127,Ермолино,"Много раз там ел, могу вас заверить готовят вкусно",17 апреля
128,Ермолино,Жаль по воскресеньям не работает,9 апреля
129,Ермолино,"Сладкая выпечка вся на 5+,остальное как зайдет",31 марта
130,Ермолино,"Берут продукты без перчаток, на замечание, ответ, какая разница все равно варить будете",13 ноября 2022
131,Карамель,"Хлеб вкусный периодически беру в этой пекарне. Вчера был неприятный случай, говорю , дайте мне 2 буханки картофельного хлеба, продавец говорит 138 рублей, прикладывайте карту. Я прикладываю , и параллельно спрашиваю, а как Вы считаете? Может по весу как чебатту? Она мне отвечает, а зачем оплачиваете раз неправильно ? 
Я опешила от такой наглости конечно, ответила, что я вот и думаю что многовато. Она говорит, надо сказать раз заметили, я говорю, я и спрашиваю!
Сделала она возврат на карту, уже собрался народ в очередь, она мне снова: В другой раз смотрите ! 
Я уж не сдержалась и отвечаю, Вы меня почему крайней делаете? Вы ошиблись, а я виновата! Она спрашивает мне вслед. А вы не ошибаетесь на работе? Я ответила что ошибаюсь, но признаю это, извиняюсь, переделываю, и крайними людей не делаю!
 Уважаемое руководство, проведите беседу с персоналом. Что за хамское отношение? Идти туда после этого инцидента вообще не хочется. Пусть поучатся в конкурируещец сети пекарен.",6 ноября
132,Карамель,"Продавцы сделайте попроще лица , учитесь разговаривать с людьми . Страшно к вам ходить , ощущение что кусаетесь",2 октября
133,Карамель,Карамель просто чудо все всегда свежие и вкусное!,25 августа
134,Карамель,Первый раз попала в эту кондитерку и больше не зайду. На кассе злая тёткачуть ли не кинула покупку в лицо. Пирожок с яблоками из сухих замоченных яблок. Ужас!!!,7 июня
135,Карамель,Хорошая продукция. Всё свежее,4 мая
136,Карамель,"Хорошая пекарня, готовят вкусно, большой ассортимент. Но что то не то в последнее время с рецептурой выпечки хлеба: хлеб хорош первые 2 часа пока свежий , затем просто крошится, нарезать невозможно. Заезжала в основном за хлебом, теперь буду искать в другом месте.",8 апреля
137,Карамель,Очень вкусно. Всегда всё свежее.,14 марта
138,Карамель,Очень вкусно,10 марта
139,Карамель,"Покупала торт Прага. В первый день был вкусный, на третий заплесневел ( к сожалению, на коробке не стоит дата и не указан состав.",14 декабря 2022
140,Мирабэль,Хорошие магазин. Большой выбор парфюмерии.,25 июня
141,Остров сокровищ,Большой магазин с огромным выбором игрушек.,25 июня
142,Светильники,"Магазин классный, широчайший ассортимент всего что и пускает свет. Лампочки и другая необходимая мелочь. Девушка продавец очень доброделательная и всегда подскажет и расскажет про понравившуюсь люстру. Рекомендую этот магазин.",1 ноября
143,CleopatrA,Топ,20 января
144,CleopatrA,"Хорошая точка, приятные продавцы) есть выбор товара, всегда чисто и приятно даже просто посмотреть) никто и не ругается, и всегда помогут с выбором",31 октября 2022
